{
  "$schema": "https://json-schema.org/draft/2020-12/schema",
  "$id": "https://momentive-bi-digest.invalid/contracts/RejectedClaim.schema.json",
  "title": "RejectedClaim",
  "description": "One line of evidence/rejected/<run_id>.jsonl. Rejection is permanent: nothing here is patched, coerced or retried beyond the router's single retry. raw MUST be the post-scrub model output, never source text, because this file is committed to a public store repository.",
  "type": "object",
  "properties": {
    "schema_version": {
      "const": "1.0.0",
      "type": "string",
      "description": "Contract version of this document. Bump minor for an additive change, major for a breaking one."
    },
    "run_id": {
      "type": "string",
      "pattern": "^\\d{4}-\\d{2}-\\d{2}T\\d{2}:\\d{2}Z$"
    },
    "source": {
      "type": "string",
      "enum": [
        "gong",
        "salesforce"
      ]
    },
    "source_id": {
      "type": "string",
      "minLength": 1,
      "maxLength": 40
    },
    "reason_code": {
      "type": "string",
      "enum": [
        "schema_invalid",
        "citation_unresolved",
        "speaker_not_client",
        "duplicate",
        "window_violation"
      ]
    },
    "reason": {
      "type": "string",
      "minLength": 1,
      "maxLength": 500,
      "description": "Human readable detail, for example the jsonschema error path and message."
    },
    "raw": {
      "type": "object",
      "additionalProperties": true,
      "description": "The post-scrub model output that was rejected. Never source text with PII."
    }
  },
  "required": [
    "schema_version",
    "run_id",
    "source",
    "source_id",
    "reason_code",
    "reason",
    "raw"
  ],
  "additionalProperties": false
}
